question,answer
支持哪些支付方式？,我们接受多种支付方式：信用卡、借记卡、PayPal、Apple Pay和Google Pay等主流支付工具，确保您的购买过程既安全又便捷。选择您最方便的支付方式，轻松完成交易。
可以使用微信支付吗？,当然可以！您可以通过我们的官方网站进行购买，并选择微信支付作为您的付款方式之一。我们支持多种便捷的在线支付方式，以满足不同顾客的需求。
你们支持分期付款吗？,我们与多个金融合作伙伴合作，提供包括信用卡、借记卡和多种在线支付选项在内的多种支付方式。部分商品或服务可能支持分期付款，请在结算时查看具体选项。
你们的支付方式有哪些？,我们支持多种安全便捷的支付方式，包括信用卡、借记卡、第三方支付平台（如支付宝、微信支付）等主流渠道。请根据您的需求选择合适的支付方式。
付款方式有哪些？,我们支持多种支付方式，包括但不限于支付宝、微信支付、银行卡转账等主流渠道。请在购物车结算时选择您方便的支付方式。
是否支持分期付款？,我们目前不直接提供分期付款服务，但可以通过第三方支付平台或信用卡进行部分分期，具体详情请咨询您所选择的支付渠道。
我需要使用特定的支付方式,我们支持多种支付方式，包括信用卡、借记卡、PayPal等在线支付选项。如果您有其他特定需求，请直接联系我们的客户服务获取帮助。
我可以使用哪些支付方式？,我们支持多种支付方式包括信用卡/借记卡、在线支付平台、银行转账和货到付款等。具体可使用的支付方式根据您的地区及购物环境而定，详情请参考商品页面或联系客服了解。
你们接受哪些支付方式？,我们支持多种在线支付方式，包括信用卡、借记卡、PayPal等主流支付工具。请根据您的需求选择最方便的支付方式。
可以使用哪些支付方式？,您可以通过信用卡、借记卡、支付宝、微信支付等多种方式进行在线支付。所有支付渠道均采用加密技术，确保您的交易安全。
支付方式有哪些？,我们支持多种支付方式，包括信用卡、借记卡、电子钱包等，具体可选方式会根据您的地区和支付偏好进行调整。在结算页面您会有更多选择，请按指示操作。
如何进行支付？,我们接受多种安全的在线支付方式，包括信用卡、借记卡、第三方支付平台等。购买过程中的支付步骤简单明了，请按照页面提示操作即可。如果您有特定的支付需求或疑问，也可以联系我们的客服获取帮助。
是否支持信用卡支付？,亲亲，目前我们的店铺支持多种支付方式，包括但不限于支付宝、微信支付等，至于信用卡支付功能，我们会尽快考虑增加，敬请期待！
你们接受哪种支付方式？,支持多种支付方式包括但不限于支付宝、微信支付、银行卡在线支付等安全便捷的支付渠道。我们承诺在支付过程中保护您的信息安全，提供给您一个放心、省心的购物环境。
我需要了解支付方式有哪些？,我们支持多种支付方式包括但不限于支付宝、微信支付、信用卡、银行转账等，您可以根据自己的方便选择最适合的付款方式。
可以分期付款吗？,抱歉，本店目前不支持分期付款服务。不过，我们提供便捷的支付宝、微信支付等多种支付方式供您选择。希望这能满足您的需求。
你们的平台支持哪些支付方式？,我们提供多种安全便捷的支付选项，包括但不限于信用卡、借记卡、PayPal及部分地区的本地银行转账等。请您在结账时选择您最方便的支付方式完成交易。
可以使用信用卡支付吗？,当然可以！我们的网站支持多种支付方式，包括信用卡支付。安全、便捷、快速，为您购物提供多样化选择。
支持哪种支付方式？,我们接受多种支付方式，包括但不限于支付宝、微信支付、银行卡在线支付等，您可以根据个人喜好进行选择。
是否支持在线支付？,亲亲，我们支持多种安全的在线支付方式，例如信用卡、借记卡和第三方支付平台。您可以根据自己的方便选择合适的支付方法完成购买流程。
你们支持哪些支付方式？,我们接受多种支付方式，包括但不限于信用卡、借记卡、支付宝和微信支付等常见渠道。请您在购买时查看页面上的支付选项以选择最适合您的方式。
安全支付保障是什么？,我们承诺使用SSL加密技术来保护您在网站上的交易和支付信息的安全。同时，我们也接受多样的支付方式，包括信用卡、Paypal等在线支付平台，并通过第三方供应商审核以确保支付流程的安全性。
你们支持什么支付方式？,我们提供多种便捷的支付方式，包括但不限于信用卡、借记卡、支付宝、微信支付等主流在线支付渠道。确保您在购买时能够选择最方便的方式完成交易。
你们的产品支持哪些支付方式？,我们接受多种支付方式包括信用卡、借记卡、支付宝、微信支付以及PayPal。您可以根据自己的喜好选择最适合的支付方式进行结算。
我能用支付宝或者微信支付吗？,当然可以！我们支持多种在线支付方式，包括支付宝、微信支付等，您可以根据自己的喜好进行选择。
你们的商品支持分期付款吗？,我们目前只接受一次性支付方式的订单处理，对于大型商品或是特定活动情况下，可能会有额外的金融方案提供。请关注我们的官方公告或联系客服了解是否有分期付款选项。
商品可以使用哪种支付方式？,我们接受多种安全便捷的在线支付方式，包括信用卡、借记卡、支付宝、微信支付等主流渠道，确保您的交易过程顺畅无阻。
可以使用多种支付方式吗？,我们支持多种安全便捷的支付方式，包括信用卡、借记卡、第三方支付平台等，请在结账时根据您的喜好选择最适合的支付方法。
你们有哪些支付方式可供选择？,我们的店铺支持多种支付方式，包括信用卡、借记卡、第三方支付平台等，请根据您的需求选择合适的支付方法。
能否提供更多的支付方式？,我们接受多种支付方式，包括信用卡、借记卡、支付宝、微信支付以及PayPal等在线支付工具，以满足不同顾客的需求。
你们支持哪几种支付方式？,我们支持多种安全便捷的支付方式，包括信用卡、借记卡支付、第三方支付平台（例如支付宝或微信支付）和银行转账等。您可以根据自己的喜好选择最适合您的支付方式。
你们支持哪种支付方式？,我们提供多种安全支付方式供您选择，包括信用卡、借记卡、第三方支付平台等，确保您的交易过程便捷且安全。
支付流程是怎样的？,亲亲，请在确认订单信息无误后，选择合适的支付方式完成付款。我们支持安全的在线支付平台，包括信用卡、借记卡、电子钱包和第三方支付服务等。支付过程简单快捷，并且所有交易均通过加密通道进行，保障您的信息安全。
关于支付安全问题？,亲亲，我们承诺提供安全的购物环境和支付流程，所有交易均采用加密技术保护您的信息不被泄露或窃取。使用信用卡、支付宝、微信支付等主流支付方式时，请确保在官方平台上进行操作，以保障交易的安全性和资金安全。
能否使用信用卡支付？,"当然可以！我们支持多种支付方式，其中包括信用卡（VISA、Mastercard等）、借记卡以及线上支付平台（如PayPal, Alipay等）。如果您有其他特定的支付需求，请随时告知我们，我们会尽力满足您的需求。"
怎么支付？,亲亲，您可以使用支付宝、微信支付、信用卡或借记卡等多种方式进行在线支付。选择您最方便的方式即可完成付款步骤。
购买多件商品是否需要支付多次运费？,亲亲，如果您一次购买了多件商品，我们会合并包裹进行配送，并只收取一次运费。这样可以确保您获得最优惠的物流费用。
如何支付？,亲亲，我们接受多种支付方式：信用卡、借记卡、PayPal或第三方支付平台等，请根据自己的需求选择最方便的方式完成支付。如果您在支付过程中遇到任何问题，我们的客服团队将随时为您提供帮助。
你们接受信用卡支付吗？,当然，我们支持多种支付方式，包括信用卡、借记卡及各类在线支付平台，为您提供便捷的购物体验。请根据您的个人喜好或需求选择最合适的支付方法进行结算。
您们接受哪些支付方式？,我们支持多种在线支付方式，包括信用卡、借记卡、PayPal等。请根据您的方便选择最适合的支付方法。
你们的店铺支持哪些支付方式？,我们的店铺接受多种支付方式，包括但不限于信用卡、借记卡、微信支付、支付宝等多种在线支付和货到付款服务，请根据您的便利选择合适的支付方式。
是否接受信用卡支付？,我们支持多种在线支付方式，包括信用卡、借记卡等。具体可接受的支付方式会在结账页面显示。如果您有特定的支付需求或遇到任何支付问题，请随时联系我们的客服团队获取帮助。
你们的店铺接受哪种支付方式？,我们支持支付宝、微信支付以及银行转账等多种支付方式，确保您的购物过程安全便捷。
有什么支付方式？,我们支持多种安全便捷的支付方式，包括但不限于信用卡、支付宝、微信支付以及银行转账。请您根据自己的喜好和方便选择适合您的支付渠道。
你们接受哪种付款方式？,我们支持多种支付方式，包括但不限于信用卡、借记卡、电子钱包和银行转账。具体可用的支付方式将根据您的地区和个人账户情况有所不同，请在结账时查看适用选项。
接受哪些支付方式？,我们支持...等多种支付选项以提供给您最大的便利和安全性。无论您的偏好如何，我们都希望您可以轻松完成交易。
我需要提供什么付款方式？,我们接受多种支付方式，包括信用卡、借记卡、电子钱包等。在结账过程中您可以选择合适的选项进行支付。请注意具体可选的支付方法可能会根据您所在的地区和商品的不同而有所变化。
你们支持的支付方式有哪些？,我们接受多种支付方式，包括信用卡、借记卡、支付宝、微信支付等主流支付工具。请在结账时选择您方便的方式进行支付。
这款产品支持分期付款吗？,我们目前只提供一次性支付方式，请在购物车中完成交易。若您需要更多的财务规划建议或有其他需求，建议您咨询专业的金融顾问。
我怎么支付呢？,亲亲，我们接受多种支付方式：信用卡、借记卡、支付宝、微信支付等主流平台，安全便捷。您只需选择最方便的支付渠道进行操作即可。
支付方式有哪些选择？,亲亲，我们支持多种支付方式，包括但不限于信用卡、借记卡、支付宝、微信支付、PayPal和Apple Pay等主流渠道，以满足不同用户的需求。
贵店支持哪些支付方式？,亲亲，我们提供多种安全便捷的支付选项，包括但不限于信用卡、借记卡、支付宝、微信支付等主流在线支付方式。请根据您方便的方式进行选择。
购买流程中的支付安全吗？,我们采用行业标准的安全加密技术，确保您在支付过程中的信息安全。无论是使用信用卡、借记卡还是在线支付方式，都可以得到充分的保护。
购买过程中遇到支付问题怎么办？,如果您在支付过程中遇到任何困难，请立即与我们联系。我们的客户服务团队将提供实时帮助和指导，以确保您顺利完成交易。
我需要知道支付方式？,我们提供多种安全便捷的支付方式供您选择，包括信用卡、借记卡、网上银行转账等。您可以根据自己的喜好和方便进行选择。
你们支持哪些付款方式？,我们接受多种支付方式，包括信用卡、借记卡、PayPal、货到付款等。具体的支付选项会根据您所在的地区或购买平台有所不同，请在结账时查看相关提示。
关于支付方式？,我们接受多种安全的支付方式，包括信用卡、借记卡、支付宝、微信支付等主流平台。请注意保护您的个人信息和资金安全。
如何支付？接受哪种付款方式？,我们提供安全的在线支付选项，包括信用卡、借记卡、PayPal以及其他电子钱包服务。您可以选择最方便的方式进行支付，并且我们承诺所有的交易都是通过加密保护的，确保您的信息安全。
这款产品支持哪些支付方式？,我们接受多种支付方式，包括信用卡、借记卡、电子钱包等主流支付工具。请在结账时选择您最方便的选项进行付款。
我需要了解支付方式和安全性？,亲亲，请放心。我们平台提供了安全、便捷的支付选项，包括信用卡、Paypal等主流支付方式。并且，您的交易信息将受到严格保护，确保您的隐私安全。
你们的商品有哪些支付方式？,我们接受多种支付方式以提供给您更多的便利和选择，包括但不限于信用卡、借记卡、PayPal、Apple Pay和Google Pay等主流电子支付平台。请在结账时根据您的个人喜好进行选择。
购物车中的商品能合并支付吗？,亲亲，当然可以！在结算前，您可以直接选择将多个商品添加至购物车并一起完成支付，也可以在结账时选择不同地址进行分批配送。如果您需要调整，请随时联系客服协助处理。
你们的商品是否支持分期付款？,我们与多家金融机构合作提供灵活的支付方案，包括但不限于分期付款服务。您在结账时可选择相应的支付方式查看具体条件和选项。如有任何疑问或特定需求，请联系我们的客服团队获取更多信息。
商品能支持分期付款吗？,亲亲，我们目前提供的支付方式中，不包括分期付款服务。不过您可以选择使用信用卡、借记卡或支付宝/微信进行全款一次性支付，安全便捷。对于大额购买有需求的客户，建议您在购买前咨询我们的客服人员，我们会尽力提供更个性化的购物体验。
是否支持信用卡付款？,"我们接受多种支付方式，包括信用卡（Visa, MasterCard等）、PayPal、网银转账和电子钱包支付。具体可用的支付选项会因地区而异，请在结账时查看可选支付方式。"
商品可以分期付款吗？,部分商品支持分期付款服务，您可以在结账步骤中查看是否有提供此项服务，并选择合适的期数和条件完成购买。
网站的支付过程是安全的吗？,我们的网站采用SSL加密技术保护您的交易信息，确保在支付过程中所有数据的安全性。同时，我们严格遵守隐私政策，不会泄露您的个人信息。
我可以用什么支付方式？,我们接受多种支付方式，包括但不限于信用卡、借记卡、支付宝、微信支付等主流在线支付工具。请根据您所在地的可选服务进行选择。
是否接受国际支付？,我们支持多种支付方式，并且努力适应全球客户的需求。通常情况下，我们会提供信用卡、PayPal等跨境支付选项，请在结账时选择合适的支付方式。如有特殊需求或遇到问题，请联系客服获取帮助。
您的网站支付过程是安全的吗？,我们非常重视客户的信息安全和交易安全，使用了最先进的加密技术保护您的个人信息及支付数据。通过SSL加密协议，您可以放心进行在线支付。
我想了解支付方式有哪些？,亲亲，我们支持多种支付方式，包括但不限于信用卡、借记卡、第三方支付平台（如支付宝和微信支付）等。请您在结账时选择适合您的付款方法。
关于支付方式有哪几种选择？,我们支持多种安全便捷的支付方式，包括但不限于信用卡、借记卡、PayPal、电子钱包和银行转账等主流在线支付渠道。请在结账时选择您最方便的方式进行结算。
这商品是否支持分期付款？,目前，我们的商品支持多种支付方式，包括但不限于信用卡、支付宝和花呗等分期支付选项。具体的分期政策会根据商家或平台政策而定，请您在结账时查看相应的支付详情。
如何支付购买商品？,您可以选择多种便捷的支付方式完成购买，包括信用卡、借记卡、Paypal、Apple Pay等常见在线支付工具。在结账时，请确保您的支付信息准确无误，并遵循安全提示保护个人信息和财务安全。
这款商品支持哪些支付方式？,亲亲，请放心，我们接受多种支付方式：信用卡、借记卡、支付宝、微信等主流在线支付工具。选择您最方便的付款方式即可进行购买。
这款商品支持分期付款吗？,是的，我们支持多种分期付款方式，具体可咨询银行或使用第三方支付平台提供的服务，以满足您的需求。
能否用外币支付？,目前我们的平台仅支持人民币支付。如果您需要购买的商品可以用其他货币表示，请先与我们联系确认支付方式和汇率转换事宜，我们会尽力为您提供帮助。
可以使用哪种支付方式？,我们接受多种支付方式，包括但不限于信用卡、借记卡、PayPal以及部分地区的本地银行转账等。请您在结账时选择您方便的支付选项完成交易。
商品是否支持分期付款？,目前我们的平台不支持直接分期付款服务，但您可以选择使用信用卡或第三方支付进行分次支付。如需更多金融方案，建议您咨询银行或其他金融机构。
购买后可以分期付款吗？,目前我们的店铺暂时不支持分期付款服务。我们希望您能享受到一次性的优惠价格和完整的产品体验，同时也保证了交易的简单性和透明度。
支付过程是否安全？使用什么方式支付最保险？,我们支持多种安全支付方式，包括信用卡、借记卡和第三方支付平台等，并采取了多重加密保护措施来确保您的交易安全。使用您信任的银行或支付平台的方式通常是最保险的选择。
能否提供多种支付方式？,当然，我们支持多种安全便捷的支付方式，包括但不限于信用卡、借记卡、支付宝、微信支付和PayPal等。请您在结账时选择最适合您的选项。
可以使用分期付款吗？,我们目前提供多种支付方式供您选择，包括信用卡、借记卡以及部分地区的在线支付和货到付款服务。关于分期付款，请直接联系我们的客服人员获取更多信息。
我可以通过什么方式支付？,我们支持多种安全便捷的支付方式，包括但不限于信用卡、借记卡、支付宝、微信支付以及PayPal等在线支付平台。请根据您的个人喜好和便利性选择合适的支付选项。
我需要了解支付方式和安全措施。,我们接受多种在线支付方式，包括但不限于信用卡、支付宝、微信支付等，并且采用先进的加密技术确保交易过程中的信息安全，让您的购物体验既便捷又安全。
可以使用支付宝或者微信支付吗？,当然支持！我们接受多种在线支付方式，包括支付宝、微信支付以及其他信用卡/借记卡等。请在结算时选择您方便的支付方式进行结算。
使用什么支付方式？,我们接受多种在线支付方式（如信用卡、借记卡、PayPal等），并且提供安全的支付环境以保护您的交易信息。选择您最方便的支付方式进行结账。
我该如何进行支付？,您可以通过支付宝、微信支付、信用卡/借记卡在线支付等方式完成购买。我们采用安全的第三方支付平台，确保您的交易信息和资金安全。
这款产品是否支持分期付款？,亲亲，目前我们只提供一次性支付方式。考虑到商品价格、库存情况以及物流安排的复杂性，暂时不支持分期付款服务。如果您有大额购买的需求或特定的支付需求，请联系我们的客服团队，我们会为您提供最合适的解决方案。
我可以通过哪些方式支付？,我们支持多种安全便捷的支付方式，包括信用卡、借记卡、第三方支付平台（如支付宝、微信支付）、银行转账以及部分地区的货到付款。具体支付选项会根据您的购买地区和所选商品而定。
支持的支付方式有哪些？,我们接受多种支付方式，包括但不限于信用卡、借记卡、PayPal、支付宝、微信支付等，请在结账时选择您方便的支付选项。
是否接受分期付款或信用支付？,我们支持多种支付方式，包括信用卡、借记卡及部分地区的分期付款服务。您可以在结账时选择相应的支付选项，并确认适用的费用和条款。如果还有其他支付需求，请联系我们，我们会尽力为您提供帮助。
这款产品支持哪种支付方式？,亲亲，我们目前支持信用卡、借记卡以及第三方支付平台等多种支付方式供您选择。具体可使用的支付选项在结账时会显示，请根据您的需求进行选择。
我想要了解更多关于支付方式的信息？,我们支持多种安全的在线支付方式，包括但不限于信用卡、借记卡、Paypal等。您的交易将受到最新的加密技术保护，确保资金安全。在结账时，请选择您方便的付款选项。
是否可以使用多种支付方式？,我们支持多种支付方式以方便您选择：信用卡、借记卡、第三方支付平台等。具体可用的支付方式会根据不同地区或政策有所变化，详情请查看网站上的支付选项页面。
可以使用支付宝付款吗？,是的，我们支持多种支付方式包括支付宝、微信支付及信用卡支付等，满足您的不同需求。在购物车结算时选择您喜欢的方式即可完成支付。
我能用哪些支付方式？,亲亲，请您放心，我们的平台支持多种支付方式：信用卡、借记卡、PayPal、微信支付和支付宝。选择您最方便的付款方式即可完成购买。
如何确保安全支付？,我们使用了先进的加密技术来保护您的交易，确保您的支付过程是安全无虞的。同时，请使用官方网站进行支付以保障信息安全。
我可以使用哪种支付方式？,您可以选择支付宝、微信支付或信用卡等多种支付方式进行结算，支持安全快捷的支付流程。
你们的网站支持哪些支付方式？,我们提供多种安全便捷的支付方式，包括但不限于信用卡、借记卡、第三方支付平台（如支付宝、微信支付）、银行转账等。在结账页面会明确显示所有可选支付选项，您可以根据自己的方便选择适合的方式完成交易。
如何支付更安全？,我们提供多种安全的支付方式供您选择：PayPal、信用卡、借记卡等在线支付系统，确保您的交易过程既快捷又安全。
我需要担心付款不安全吗？,我们采用先进的加密技术和安全协议确保您的交易信息在传输过程中的安全性。使用官方平台进行支付，可以完全放心，我们不会存储用户的敏感财务信息。
商品支持分期付款吗？,目前我们只提供全额支付的选项。如果您需要更灵活的支付方式，可以考虑使用信用卡分期、花呗或类似的金融服务，但具体是否可用以及服务条款请咨询相关金融平台。
我需要了解支付安全性,我们提供安全、可靠的在线支付方式，包括信用卡、借记卡、PayPal等。您的个人信息和交易细节均通过SSL加密技术进行保护，确保您的交易安全。
你们提供什么样的支付方式？,我们支持多种安全便捷的支付方式，包括但不限于信用卡、借记卡、第三方支付平台等主流在线支付手段。请您在结账时根据自己的需求选择合适的支付方式进行付款。
需要提供哪些信息进行支付？,为了安全和顺畅的支付过程，您在提交订单时需提供以下信息：姓名、有效的电子邮件地址、支付方式（信用卡号/支付宝账号）以及收货地址。确保这些信息准确无误可以加快处理您的订单速度。
关于支付方式有哪些选择？,我们支持支付宝、微信支付等多种线上支付方式，同时也接受信用卡和银行转账等线下支付方式。请根据自己的需求选择最适合的支付方式。
我是否需要支付进口关税？,对于非本地订单，您可能会遇到进口关税问题，这取决于您的所在地和商品的价值、类型等因素。通常情况下，我们会尽量避免这种情况发生，并在必要时提供额外的运输文件来协助解决此问题。具体情况还需要根据目的地国的政策和具体商品进行确认。
我能用哪种支付方式？,我们支持多种支付方式，包括信用卡、借记卡、支付宝、微信支付和PayPal等主流支付平台。请根据您的需求选择最方便的支付方式进行结算。
