question,answer
是否有专业的咨询团队？,我们拥有一支专业、热情的服务团队，他们会为您提供有关产品选择的建议、订单状态查询以及售后支持等服务。无论何时遇到问题，我们的客户服务都随时待命。
在购买过程中遇到问题可以联系谁？,在整个购物过程中，无论您有关于商品的疑问、物流信息查询或是需要售后服务，都可直接联系我们。请通过我们的官方网站或客服邮箱与我们联系，并提供必要的订单信息和具体问题描述，我们将为您提供即时的帮助和支持。
是否提供在线咨询？,我们提供全天候的在线咨询服务，您可以通过网站上的聊天窗口、电子邮件或社交媒体联系我们。无论何时遇到问题或有疑问，我们都将竭诚为您服务。
如何联系售中服务？,如果您在购物流程中有任何问题或需要帮助，可以访问我们的官方网站，在“客户服务”部分找到联系方式。您可以通过在线聊天、电子邮件或电话与我们联系。我们会尽快响应您的请求并提供所需的服务。
如果遇到问题如何联系客服？,如果您有任何疑问或需要帮助，请随时联系我们的在线客服，您也可以通过邮件或社交媒体平台给我们留言。我们会尽快回复并解决您的问题。
我在购买过程中遇到问题，如何联系客服？,您可以通过我们的网站在线聊天工具与我们的客服团队进行实时沟通。也可以在工作时间内拨打电话号码或发送邮件，我们会尽快回复并帮助解决您的问题。
购买过程有疑问可以咨询吗？,当然可以！在购物过程中遇到任何疑问，都可以直接联系我们的在线客服或拨打客服热线进行咨询，我们会尽快为您提供帮助。
如何联系你们的客服？,亲亲，请随时通过[提供联系方式，如：微信公众号、邮件地址、电话号码]与我们进行联系。我们的客服团队会尽快回复您，帮助解答您的所有疑问或问题。
是否提供在线客服咨询？,当然，我们全天候提供在线客服支持。无论您遇到任何问题或疑虑，都可以随时通过网站聊天窗口、电子邮件或电话联系我们获取帮助。
是否有专业客服支持？,我们有专业的客户服务团队全天候在线，为您提供售前、售中及售后的所有疑问解答与支持。您可以通过网站的在线聊天系统或电子邮件联系我们。
是否有专属客服服务？,我们提供24/7在线客服服务，在购物过程中遇到任何问题都可以随时联系我们的客服团队获取帮助和解答，我们将竭诚为您服务。
是否有专属客服解决售中问题？,当然有！我们的团队设有专门的客户服务部门，可以提供从下单咨询到商品疑问、物流跟踪等全过程服务支持，随时为您解答售中的任何问题。
购买过程中有任何问题能咨询吗？,当然可以！您在购物过程中遇到任何问题，都欢迎随时联系我们，无论是产品信息、物流状态还是支付问题，我们的客服团队都会及时响应并提供帮助。
在购买过程中需要保持联系吗？,当然，在购买过程中，我们建议您保持与我们的联系，以便及时了解订单状态、处理优惠码应用、物流信息等。若有任何疑问或需求变更，请随时告知。
我如何联系客服团队？,您可以通过网站的在线聊天工具、电子邮件或者在产品详情页下方留下的电话号码与我们联系。我们的客服团队会在工作时间内快速响应您的需求。
如果我有问题联系谁？,如果您在物流、收货或是任何其他问题上遇到困难，请直接联系我们的客户服务团队。您可以通过邮箱、在线聊天或者拨打电话的方式联系我们，我们将尽快为您提供帮助和解决方案。
我怎么联系客服？,您可以通过以下几种方式联系我们的客户服务团队：电子邮件、在线聊天或电话（如有提供）。在网站上，通常会有一个“联系我们”或者“帮助中心”的选项，您可以直接点击并选择最适合您的联系方式。我们会在最短的时间内回复您！
我需要咨询关于产品的详细信息？,亲亲，如果您对产品有任何疑问或需要更详细的说明，请随时联系我们的客服团队。我们拥有专业的产品顾问为您提供一对一服务，帮助您更好地了解产品特性、使用方法等，确保您的购物体验无任何障碍。
如何快速联系到你们的客服？,亲亲，请在任何时间通过以下方式联系我们：网站在线聊天、微信公众号消息、电子邮件或直接拨打我们的服务热线。我们会尽快回复您，以提供及时的帮助和服务。
如何评价客服态度？,我们的团队以提供热情、专业及有耐心的服务为自豪，致力于解答您的所有疑问，并为您提供全面的支持。无论何时您遇到问题或需要帮助，请随时与我们联系。
你们有提供咨询服务吗？,当然！我们提供7天24小时在线客服服务，无论是购买前的商品咨询、购买中的疑问解答还是售后问题，您都可以随时联系我们获取帮助。我们的客服团队将尽力为您提供满意的服务体验。
购买过程中遇到问题可以咨询谁？,无论您在购物过程中的任何环节遇到问题，都可以随时联系我们，无论是商品信息、付款流程还是物流跟踪，我们都有专业团队提供24小时在线客服支持。请通过我们的网站联系表或社交媒体直接与我们沟通。
购物时遇到问题如何联系客服？,在购买过程中如遇任何问题，您可以通过在线聊天框直接联系我们的客服人员；或者访问我们的店铺页面，在“联系我们”或“帮助中心”查找相关信息和常见解答。如有更详细的问题或需要进一步的帮助，请随时与我们联系，我们会尽快为您解决疑惑。
如何联系到你们？,您可以通过以下几种方式联系我们：访问我们的官方网站，在线聊天系统、电子邮件或客服电话（如适用）。通常情况下，我们会尽快在收到您的信息后回复您。如果您有紧急需求，请选择在线聊天系统进行即时沟通。
如何联系到客服团队？,您可以通过店铺主页的“联系我们”板块找到我们的客服邮箱、电话和在线聊天工具等联系方式，请根据您的需求选择最合适的沟通方式。
我可以通过电话咨询吗？,当然可以！您可以通过我们网站上的联系方式页面找到我们的联系电话，并在工作时间内拨打进行咨询。我们会尽快与您取得联系。
怎么联系你们？,您可以通过以下方式联系我们：客服邮箱：customer.service@example.com；客服电话：+86-1234567890；或者在网站上直接留言，我们将尽快回复您。
你们有英文客服服务吗？,是的，我们提供多语言客户服务，包括英语、法语和西班牙语等，您可以通过电子邮件或者电话联系我们。
怎么联系你们的客服？,亲亲，请点击页面右下角的在线客服图标，即可立即与我们的客户服务团队取得联系。如有任何问题或需要帮助的地方，随时欢迎询问！
有专属客服吗？,当然有！我们设有专门的客户服务团队，随时准备解答您的任何疑问或提供服务支持。无论是购买流程、商品咨询还是售后问题，您都可以通过在线聊天、电子邮件或电话联系我们的客服人员。我们会尽力满足您的需求，并确保每一次购物体验都是愉快和顺利的。
如何联系我们？,如果您有任何问题或需要帮助，请在工作时间内联系我们的客服中心：客服电话、QQ在线客服或者发送电子邮件至service@我们的网站邮箱，我们将尽快回复您！
能否提供联系方式？,当然可以！如有任何疑问或需要帮助，请随时联系我们的客服团队。工作时间是每天9:00至18:00，您可以发送电子邮件至service@example.com或者拨打热线电话：400-123-4567，我们将尽快为您提供支持。
有专门的产品咨询顾问吗？,我们有一个专业的团队专门为客户提供产品咨询服务，无论您对商品的任何疑问，他们都能够提供详尽解答。如果您在购买前或购买后有任何问题，请随时联系我们的客户顾问。
你们是否提供商品咨询？,当然！无论是对商品功能、使用方法、适用场景有任何疑问，还是需要进一步的产品信息和建议，您都可以通过官方网站的在线客服、邮件或社交媒体渠道联系我们。我们的专业团队会为您提供详尽的商品咨询服务，帮助您做出最合适的购买决策。
我遇到问题无法联系上你们的客服怎么办？,如果在正常工作时间内您无法通过在线聊天、电话或电子邮件联系我们，可以考虑尝试使用网站上的“联系我们”页面中的“常见问题解答”部分找到解决办法。同时，我们提供24小时自动回复服务，将尽快响应您的需求并给出解决方案。
我怎么联系你们的客服？,亲亲，您可以选择通过以下几种方式联系我们的客服：- 在网站上点击'联系我们'或进入个人中心页面寻求帮助；- 拨打我们的客服电话咨询；- 发送邮件至客户服务邮箱。您也可以在商品详情页下方找到在线聊天窗口直接提问。
你们有客服热线吗？,我们提供多种客户服务方式，包括在线聊天、电子邮件服务以及社交媒体互动等渠道。如果您更偏爱电话沟通，请留意我们的官方客服热线号码（如果有），或者通过联系信息页面查询详细联系方式。
